{
  "schemaVersion": 1,
  "itemId": "ITEM_WOOD_BRANCH",
  "displayNameKey": "item.wood.branch",
  "category": "RawMaterial",
  "worldRepresentation": "StackablePickup",
  "unitMassGrams": 120,
  "unitVolumeCm3": 350,
  "maxStack": 24,
  "durabilityModel": "None",
  "stateModel": "None",
  "allowedActions": [
    "Pickup",
    "Drop",
    "Craft"
  ],
  "tags": [
    "MAT_WOOD",
    "RESOURCE_PLANT"
  ],
  "persistencePolicy": "InventorySave",
  "feedbackEventIds": [
    "EVT_ITEM_PICKED_UP"
  ],
  "notes": "Example only; values are placeholders and must be balanced."
}
